{"taskId":"aaaaaaaa-aaaa-4aaa-8aaa-aaaaaaaaaaaa","nodeId":"node-office-mac","moduleId":"dev.murchalka.node-diagnostics","moduleVersion":"1.0.0","capabilityId":"node.diagnostics.echo","capabilityVersion":"1.0.0","providerInstance":"node-office-mac:diagnostics","actorReference":"person:owner","purpose":"diagnostics","actionGrant":{"grantId":"bbbbbbbb-bbbb-4bbb-8bbb-bbbbbbbbbbbb","nodeId":"node-office-mac","consumerModuleId":"dev.murchalka.node-controller","providerModuleId":"dev.murchalka.node-diagnostics","capabilityId":"node.diagnostics.echo","argumentsDigest":"sha256:aaaaaaaaaaaaaaaaaaaaaaaaaaaaaaaaaaaaaaaaaaaaaaaaaaaaaaaaaaaaaaaa","issuedAt":"2026-08-27T00:00:00Z","expiresAt":"2026-08-27T00:01:00Z","policyRevision":1,"nonce":"0123456789abcdef","keyId":"controller-1","signature":"MDEyMzQ1Njc4OWFiY2RlZg=="},"arguments":{"message":"ping"},"allowedPaths":[],"allowedNetwork":[],"secretHandles":[],"resourceBudget":{"cpuMillis":1000,"memoryBytes":67108864,"outputBytes":65536},"deadline":"2026-08-27T00:01:00Z","idempotencyKey":"diagnostics-1","traceId":"trace-1"}
